{
  "schema": "forge-firearm-identity-ai-response-v4",
  "requested_identity": "M249",
  "classification": "handheld_firearm_supported",
  "canonical_name": "M249 light machine gun",
  "confidence": 0.98,
  "identity_evidence": ["shoulder-fired belt-fed light machine gun with side-mounted ammunition box"],
  "visual_description_en": "recognizable M249 side silhouette with fixed stock, top feed cover, long ventilated fore-end, bipod, and side-hanging belt box",
  "required_identity_parts_zh": ["固定枪托", "机匣上供弹盖", "侧挂弹链箱", "前部两脚架"],
  "visual_identity_axes": {
    "stock_profile": "solid fixed shoulder stock behind box receiver",
    "upper_landmark": "raised hinged feed cover above receiver",
    "magazine_profile": "rectangular belt box hanging from receiver side",
    "fore_end_profile": "long ventilated handguard ending in folded bipod",
    "receiver_profile": "deep rectangular belt-fed receiver"
  },
  "required_landmarks_en": ["raised top feed cover", "side-hanging belt box", "long fore-end with folded bipod"],
  "confusable_exclusions_en": ["not a detachable-magazine assault rifle without a feed cover or belt box"],
  "declaration": {
    "weapon_domain": "handheld_firearm",
    "firearm_family": "light_machine_gun",
    "layout": "belt_fed_support",
    "stock_structure": "fixed",
    "feed_position": "side_feed",
    "magazine_shape": "belt_box",
    "barrel_length": "long",
    "upper_profile": "feed_cover",
    "support_mode": "two_hand_shouldered",
    "fire_control": "select_fire_auto",
    "action_mechanism": "self_loading",
    "feed_system": "belt_box",
    "shot_pattern": "single_projectile",
    "sustained_climb": "progressive",
    "cadence": "rapid",
    "recoil": "medium",
    "recoil_recovery": "balanced",
    "muzzle_climb": "high",
    "accuracy": "controlled",
    "impact_force": "medium",
    "penetration": "strong",
    "reload": "slow",
    "effective_range": "long",
    "handling": "heavy",
    "magazine_capacity": "belt",
    "finish_palette": "olive_black"
  }
}
