{
  "schema": "forge-firearm-identity-ai-response-v4",
  "requested_identity": "S&W 686",
  "classification": "handheld_firearm_supported",
  "canonical_name": "Smith & Wesson Model 686",
  "confidence": 0.96,
  "identity_evidence": ["double-action revolver with a six-round swing-out cylinder"],
  "visual_description_en": "recognizable stainless revolver silhouette with exposed hammer, central cylinder, curved grip, and full underlug barrel",
  "required_identity_parts_zh": ["中央转轮弹巢", "弧形握把", "外露击锤", "全长枪管下凸部"],
  "visual_identity_axes": {
    "stock_profile": "none with curved revolver grip at rear",
    "upper_landmark": "exposed hammer behind the top strap",
    "magazine_profile": "large round swing-out cylinder at frame center",
    "fore_end_profile": "full underlug beneath medium barrel",
    "receiver_profile": "stainless revolver frame wrapped around cylinder"
  },
  "required_landmarks_en": ["round central cylinder", "curved rear grip", "exposed hammer and full underlug barrel"],
  "confusable_exclusions_en": ["not a semi-automatic pistol with a rectangular slide and in-grip magazine"],
  "declaration": {
    "weapon_domain": "handheld_firearm",
    "firearm_family": "revolver",
    "layout": "revolver",
    "stock_structure": "none",
    "feed_position": "cylinder_center",
    "magazine_shape": "cylinder",
    "barrel_length": "medium",
    "upper_profile": "revolver_frame",
    "support_mode": "one_hand",
    "fire_control": "semi_auto",
    "action_mechanism": "revolving_cylinder",
    "feed_system": "revolving_cylinder",
    "shot_pattern": "single_projectile",
    "sustained_climb": "none",
    "cadence": "deliberate",
    "recoil": "strong",
    "recoil_recovery": "slow",
    "muzzle_climb": "high",
    "accuracy": "precise",
    "impact_force": "strong",
    "penetration": "medium",
    "reload": "slow",
    "effective_range": "short",
    "handling": "agile",
    "magazine_capacity": "very_low",
    "finish_palette": "gunmetal_black"
  }
}
